parent,name*,displayName,description,sourceSystem,storageLocation,dataFormat,updateFrequency,volumeEstimated,technicalOwner,businessOwner,tags,sensibilidad,status
,G1.D001.Consumo Cliente,Consumo Cliente,Consumo de energía agregado en períodos de 15 minutos por cliente,Contadores de medida inteligentes,HDFS: /data/raw/energy/consumption,CSV/Parquet,Cada 15 minutos,500 GB/mes,Ingeniero Infrastructure,Jefe Operaciones Red,Energía;RTB;Real-time;Mediciones,PersonalData.Personal;PII.Sensitive,Active
,G1.D002.Producción Planta,Producción Planta,Energía generada por cada planta renovable en períodos de 15 minutos,Sistemas SCADA plantas,HDFS: /data/raw/energy/production,Time-series JSON,Cada 15 minutos,350 GB/mes,Ingeniero Infrastructure,Director Producción,Energía;RTB;Real-time;Generación,PII.NonSensitive,Active
,G1.D003.Datos Cliente CRM,Datos Cliente CRM,Registro maestro de clientes: ID anonimizado; tipo; ubicación; contrato,CRM Salesforce,PostgreSQL: public.customers,Structured Data,Batch diario,50 MB,DBA Data Warehouse,Jefe de CRM,CRM;Clientes;Batch;Maestro,PersonalData.Personal;PII.Sensitive,Active
,G1.D004.Datos Climáticos,Datos Climáticos,Temperatura; humedad; velocidad viento; radiación solar; precipitación,APIs meteorológicas externas,HDFS: /data/raw/weather,JSON,Cada hora,100 GB/mes,Ingeniero Infrastructure,Jefe IA/ML,Meteorología;Externos;RTB;Predicción,PII.NonSensitive,Active
,G1.D005.Calendarios Laborales,Calendarios Laborales,Festivos; fines de semana; períodos vacacionales por zona geográfica,Sistema RR.HH. + Configuración,PostgreSQL: public.calendars,Structured Data,Semestral,5 MB,Analista de Datos,Jefe Operaciones Red,Calendarios;Batch;Referencial,PII.NonSensitive,Active
,G1.D006.Mantenimiento Programado,Mantenimiento Programado,Calendario de mantenimiento: fecha; planta; equipos; duración,Sistema de gestión de mantenimiento,PostgreSQL: public.maintenance_schedule,Structured Data,Ad-hoc / Mensual,10 MB,Técnico de Mantenimiento,Director Producción,Mantenimiento;Plantas;Batch,PII.NonSensitive,Active
,G1.D007.Disponibilidad Equipos,Disponibilidad Equipos,Estado de disponibilidad de equipos de reparación y respuesta,Sistema de gestión de equipos,Service Management DB,Structured Data,Real-time,5 MB,Jefe Operaciones IT,Director Producción,Operaciones;Equipos;Real-time,PII.NonSensitive,Active
,G1.D008.Consumo Anonimizado,Consumo Anonimizado,D001 con ID cliente transformado mediante hash criptográfico SHA-256 irreversible,Transformación post-validación de D001,HDFS: /data/processed/energy/consumption_anonymized,Parquet,Cada 15 minutos,500 GB/mes,Ingeniero Security,Jefe Gobierno Dato,Energía;Anonimizado;GDPR;Procesado,PersonalData.SpecialCategory;PII.Sensitive;Anonymized,Active
,G1.D009.Predicción de Demanda,Predicción de Demanda,Salida del modelo IA: predicción de demanda por ventana temporal (24h; 48h; 7d),Modelo IA/ML entrenado,PostgreSQL + Redis cache: public.demand_forecast,JSON/Structured,Post-ejecución modelo,50 GB/mes,Ingeniero IA/ML,Jefe Operaciones Red,IA/ML;Predicción;Demanda;Cache,PII.NonSensitive,Active